{"apiVersion":"eak/v0.2","kind":"DomainPack","metadata":{"id":"medical.core","version":"0.2.0","displayName":"Medical Core"},"spec":{"extends":[],"registrations":{"capabilities":[{"id":"document.parse","version":"1.0.0"},{"id":"medical.imaging.chest_xray.classify","version":"1.0.0"}],"knowledge":[{"id":"medical.knowledge","version":"1.0.0"}],"policies":[],"evaluations":[]},"providerRequirements":[{"capability":{"id":"medical.imaging.chest_xray.classify","version":"1.0.0"},"certificationProfile":"medical.research-assist"}]}}