{"apiVersion":"eak/v0.2","kind":"DomainPack","metadata":{"id":"legal.core","version":"0.2.0","displayName":"Legal Research & Review"},"spec":{"extends":[],"registrations":{"capabilities":[{"id":"legal.document.normalize","version":"1.0.0"},{"id":"legal.authority.retrieve","version":"1.0.0"},{"id":"legal.contract.analyze","version":"1.0.0"}],"workflows":[{"id":"legal.contract-review","version":"0.2.0"}],"policies":[{"id":"legal.jurisdiction-required","version":"0.2.0"},{"id":"legal.lawyer-review","version":"0.2.0"}],"knowledge":[{"id":"legal.authorities","version":"0.1.0"}],"evaluations":[{"id":"legal.citation.eval","version":"0.1.0"}]},"providerRequirements":[{"capability":{"id":"legal.contract.analyze","version":"1.0.0"},"certificationProfile":"legal.analysis-review"}],"compatibility":{"kernel":">=0.2 <1.0"}}}