{"apiVersion":"eak/v0.2","kind":"DomainPack","metadata":{"id":"aec.core","version":"0.2.0","displayName":"AEC Core"},"spec":{"extends":[],"registrations":{"capabilities":[{"id":"aec.ifc.parse","version":"1.0.0"},{"id":"aec.compliance.check","version":"1.0.0"}],"knowledge":[{"id":"aec.knowledge","version":"1.0.0"}],"policies":[],"evaluations":[]},"providerRequirements":[{"capability":{"id":"aec.compliance.check","version":"1.0.0"},"certificationProfile":"aec.compliance-review"}]}}