{"apiVersion":"eak/v0.2","kind":"DomainPack","metadata":{"id":"medical.core","version":"0.2.0","displayName":"Medical Research & Decision Support"},"spec":{"extends":[],"registrations":{"capabilities":[{"id":"document.parse","version":"1.0.0"},{"id":"knowledge.retrieve","version":"1.0.0"},{"id":"medical.imaging.chest_xray.classify","version":"1.0.0"},{"id":"medical.dermatology.lesion.segment","version":"1.0.0"}],"workflows":[{"id":"medical.research-assist","version":"0.2.0"},{"id":"medical.image-assist","version":"0.2.0"}],"policies":[{"id":"medical.human-review","version":"0.2.0"},{"id":"medical.egress","version":"0.2.0"}],"knowledge":[{"id":"medical.guidelines","version":"0.1.0"}],"evaluations":[{"id":"medical.research-assist.eval","version":"0.1.0"}]},"providerRequirements":[{"capability":{"id":"medical.imaging.chest_xray.classify","version":"1.0.0"},"certificationProfile":"medical.research-assist"},{"capability":{"id":"medical.dermatology.lesion.segment","version":"1.0.0"},"certificationProfile":"medical.research-assist"}],"compatibility":{"kernel":">=0.2 <1.0"}}}