{"apiVersion":"eak/v0.2","kind":"DomainPack","metadata":{"id":"aec.core","version":"0.2.0","displayName":"AEC Expert Systems"},"spec":{"extends":[],"registrations":{"capabilities":[{"id":"aec.ifc.parse","version":"1.0.0"},{"id":"aec.compliance.check","version":"1.0.0"}],"workflows":[{"id":"aec.compliance-review","version":"0.2.0"}],"policies":[{"id":"aec.engineer-review","version":"0.2.0"}],"knowledge":[{"id":"aec.codes","version":"0.1.0"}],"evaluations":[{"id":"aec.compliance.eval","version":"0.1.0"}]},"providerRequirements":[{"capability":{"id":"aec.compliance.check","version":"1.0.0"},"certificationProfile":"aec.compliance-review"}],"compatibility":{"kernel":">=0.2 <1.0"}}}