{"apiVersion":"eak/v0.2","kind":"DomainPack","metadata":{"id":"legal.core","version":"0.2.0","displayName":"Legal Core"},"spec":{"extends":[],"registrations":{"capabilities":[{"id":"legal.document.normalize","version":"1.0.0"},{"id":"legal.authority.retrieve","version":"1.0.0"},{"id":"legal.contract.analyze","version":"1.0.0"}],"knowledge":[{"id":"legal.knowledge","version":"1.0.0"}],"policies":[],"evaluations":[]},"providerRequirements":[{"capability":{"id":"legal.contract.analyze","version":"1.0.0"},"certificationProfile":"legal.analysis-review"}]}}